ID,title,abstract,content,content_html,created_at,tag,updated_at
,儿童拔牙后需要注意哪些方面？,儿童拔牙后需要注意哪些方面？ 随着口腔健康教育的不断普及，儿童拔牙也越来越受到家长朋友们的关注，但是儿童对于拔牙之后的护理意识较差，因此家长们应该多监督。那儿童拔牙之后应该注意些什么呢？  儿童拔牙之后的注意事项 1、拔牙24小时不要漱口、刷牙。因为拔牙后，伤口还没有愈合，若急于漱口刷牙，则有可能将,<p> 随着口腔健康教育的不断普及，儿童拔牙也越来越受到家长朋友们的关注，但是儿童对于拔牙之后的护理意识较差，因此家长们应该多监督。那儿童拔牙之后应该注意些什么呢？<br /><br /> <br /><br /> 儿童拔牙之后的注意事项<br /><br /> 1、拔牙24小时不要漱口、刷牙。因为拔牙后，伤口还没有愈合，若急于漱口刷牙，则有可能将血块漱掉、刷掉而造成再出血，或引起牙窝空虚而导致痛苦悲伤难忍的&ldquo;干槽症&rdquo;，延长痊愈时间。<br /><br /> 2、拔牙后要咬住压在伤口上的消毒棉球或纱布，以达到压迫伤口、帮助止血的目的，要坚持半小时以后才能吐掉。<br /><br /> 3、拔牙2小时后再进食。患者应多吃些流质类食品，不要喝热开水或进食过烫、过硬的食品。热食会引起血管扩张而易于出血。<br /><br /> 4、牙齿拔除后若伤口出血不止或不时吐出血块，可采取简单的止血方法，比如用洁净的冷毛巾或蘸冰水的纱布敷于拔牙一侧面部，局部血管碰到冷刺激会自行收缩而止血。也可以用消毒棉球或纱布塞于伤口上，稍用力咬住，即可止血。假如不能控制，要尽快请医生处理。<br /><br /> 5、拔牙后5到7天，家长一定要带孩子到医院拆线换药。</p>,<p> 随着口腔健康教育的不断普及，儿童拔牙也越来越受到家长朋友们的关注，但是儿童对于拔牙之后的护理意识较差，因此家长们应该多监督。那儿童拔牙之后应该注意些什么呢？<br /><br /> <br /><br /> 儿童拔牙之后的注意事项<br /><br /> 1、拔牙24小时不要漱口、刷牙。因为拔牙后，伤口还没有愈合，若急于漱口刷牙，则有可能将血块漱掉、刷掉而造成再出血，或引起牙窝空虚而导致痛苦悲伤难忍的&ldquo;干槽症&rdquo;，延长痊愈时间。<br /><br /> 2、拔牙后要咬住压在伤口上的消毒棉球或纱布，以达到压迫伤口、帮助止血的目的，要坚持半小时以后才能吐掉。<br /><br /> 3、拔牙2小时后再进食。患者应多吃些流质类食品，不要喝热开水或进食过烫、过硬的食品。热食会引起血管扩张而易于出血。<br /><br /> 4、牙齿拔除后若伤口出血不止或不时吐出血块，可采取简单的止血方法，比如用洁净的冷毛巾或蘸冰水的纱布敷于拔牙一侧面部，局部血管碰到冷刺激会自行收缩而止血。也可以用消毒棉球或纱布塞于伤口上，稍用力咬住，即可止血。假如不能控制，要尽快请医生处理。<br /><br /> 5、拔牙后5到7天，家长一定要带孩子到医院拆线换药。</p>,,"拔牙需要注意哪些方面,儿童拔牙,",
,"拔牙有哪些注意事项,怎么拔牙好","拔牙有哪些注意事项,怎么拔牙好 因为有些朋友喜欢吃甜食或者抽烟喝酒，平时对口腔的卫生也不重视，因此导致了牙齿出现损坏，只有进行拔牙去除坏死的牙齿，但是有些拔牙的事项需要注意，以免出现不必要的麻烦。 直接咨询医生 专家指出：拔牙注意事项共有以下几个方面 1、除了智齿，其他牙齿在拔除后三个月左右，要及时",<p> 因为有些朋友喜欢吃甜食或者抽烟喝酒，平时对口腔的卫生也不重视，因此导致了牙齿出现损坏，只有进行拔牙去除坏死的牙齿，但是有些拔牙的事项需要注意，以免出现不必要的麻烦。 直接咨询医生<br /><br /> 专家指出：拔牙注意事项共有以下几个方面<br /><br /> 1、除了智齿，其他牙齿在拔除后三个月左右，要及时复诊修复，否则会引起相邻的牙齿倾斜、对颌牙齿伸长，破坏正常的咬合关系。<br /><br /> 2、拔牙是创伤性手术，患感冒时身体抵抗力弱，拔牙可能引起术后的感染；一般来说，处于急性炎症期，不能拔牙，但这也不是一概而论，部分炎症可以通过拔牙引流，减轻症状，这需要专业医生来判断。一些患有系统性疾病的患者，如糖尿病、心脏病、高血压等，必须当病情控制在安全范围内才能拔牙，甲亢、肝炎、肾炎患者以及老年人，拔牙前也应进行必要的检查和治疗。<br /><br /> 3、拔牙选择的时间也很重要：口腔中心专家建议患者上午去拔牙，因为上午人的身体，如血压等指标趋于稳定，能抵抗较大的损伤，不易出现异常状况。<br /><br /> 4、拔牙后两小时内，不能进食、不能漱口。两小时后，可以进食一些半流质食物，不要吃太烫、太硬的食物，也要避免辛辣、刺激性食物，多吃富含维生素的水果和水果汁，补充营养，促进伤口愈合，注意要用非手术一侧咀嚼。<br /><br /> 5、拔牙后数日不要吸烟，因为香烟的烟雾对拔牙伤口也会产生有害刺激作用，影响凝血过程，亦不可饮酒或吃辛辣等刺激性食物，以免加重疼痛或出血。千万不要用未经消毒的纸、棉花、牙粉等塞入拔牙伤口内。<br /><br /> 6、女性月经期不能拔牙，拔牙可能引起大出血，妊娠期拔牙可能诱发早产甚至流产。</p>,<p> 因为有些朋友喜欢吃甜食或者抽烟喝酒，平时对口腔的卫生也不重视，因此导致了牙齿出现损坏，只有进行拔牙去除坏死的牙齿，但是有些拔牙的事项需要注意，以免出现不必要的麻烦。 直接咨询医生<br /><br /> 专家指出：拔牙注意事项共有以下几个方面<br /><br /> 1、除了智齿，其他牙齿在拔除后三个月左右，要及时复诊修复，否则会引起相邻的牙齿倾斜、对颌牙齿伸长，破坏正常的咬合关系。<br /><br /> 2、拔牙是创伤性手术，患感冒时身体抵抗力弱，拔牙可能引起术后的感染；一般来说，处于急性炎症期，不能拔牙，但这也不是一概而论，部分炎症可以通过拔牙引流，减轻症状，这需要专业医生来判断。一些患有系统性疾病的患者，如糖尿病、心脏病、高血压等，必须当病情控制在安全范围内才能拔牙，甲亢、肝炎、肾炎患者以及老年人，拔牙前也应进行必要的检查和治疗。<br /><br /> 3、拔牙选择的时间也很重要：口腔中心专家建议患者上午去拔牙，因为上午人的身体，如血压等指标趋于稳定，能抵抗较大的损伤，不易出现异常状况。<br /><br /> 4、拔牙后两小时内，不能进食、不能漱口。两小时后，可以进食一些半流质食物，不要吃太烫、太硬的食物，也要避免辛辣、刺激性食物，多吃富含维生素的水果和水果汁，补充营养，促进伤口愈合，注意要用非手术一侧咀嚼。<br /><br /> 5、拔牙后数日不要吸烟，因为香烟的烟雾对拔牙伤口也会产生有害刺激作用，影响凝血过程，亦不可饮酒或吃辛辣等刺激性食物，以免加重疼痛或出血。千万不要用未经消毒的纸、棉花、牙粉等塞入拔牙伤口内。<br /><br /> 6、女性月经期不能拔牙，拔牙可能引起大出血，妊娠期拔牙可能诱发早产甚至流产。</p>,,"拔牙注意事项,拔牙,",
,拔牙后多久不出血 医生为您解析,拔牙后多久不出血 医生为您解析 拔牙后多久不出血？拔牙对于很多朋友来说已经不陌生了，现在的人基本上都是有过拔牙的经历，但对于拔牙后多久不出血这个问题很多人还是不知道的。今天我们就请来了口腔科医生来为大家解答拔牙后多久不出血。 拔牙后多久不出血 拔牙后多久不出血？口腔科医生表示：拔牙后还会出血属于正常,<p> 拔牙后多久不出血？拔牙对于很多朋友来说已经不陌生了，现在的人基本上都是有过拔牙的经历，但对于拔牙后多久不出血这个问题很多人还是不知道的。今天我们就请来了口腔科医生来为大家解答拔牙后多久不出血。<br /><br /> 拔牙后多久不出血<br /><br /> 拔牙后多久不出血？口腔科医生表示：拔牙后还会出血属于正常现象，不用太紧张。正常情况下。拔牙后牙槽内有少量出血，经过适当压迫，一般可在1小时内停止。若拔牙后数小时，甚至数天内，创口仍有鲜血流出，这就属于拔牙后出血了，尽可能的去医院找主治医生咨询情况并采取治疗。<br /><br /> 一般情况拔牙后出血多发生于：牙槽窝感染，感染由病牙根尖炎症扩散或操作不当引起；牙槽窝内有感染的断根或病变的肉芽组织末彻底除净；拔牙后吃了粗糙、刺激性食物，或刷牙破坏了血凝瑰使血凝块凝固不好；血液疾病，如白血病和再生障碍性贫血等。<br /><br /> 所以说，拔牙虽不是什么大事，但如果不加以重视很容易引发严重的后果。若出血为局部炎症引起，可用碘甘油局部涂擦，局部用上海白药粉或其它止血粉和止血海绵压迫。属拔牙断根或有病组织引起的出血，应注射麻药后取去断根，搔刮牙槽窝，去净炎性肉芽组织，必要时严密缝合。拔牙后出血伴有局部红肿、全身发烧者应请医生诊治。</p>,<p> 拔牙后多久不出血？拔牙对于很多朋友来说已经不陌生了，现在的人基本上都是有过拔牙的经历，但对于拔牙后多久不出血这个问题很多人还是不知道的。今天我们就请来了口腔科医生来为大家解答拔牙后多久不出血。<br /><br /> 拔牙后多久不出血<br /><br /> 拔牙后多久不出血？口腔科医生表示：拔牙后还会出血属于正常现象，不用太紧张。正常情况下。拔牙后牙槽内有少量出血，经过适当压迫，一般可在1小时内停止。若拔牙后数小时，甚至数天内，创口仍有鲜血流出，这就属于拔牙后出血了，尽可能的去医院找主治医生咨询情况并采取治疗。<br /><br /> 一般情况拔牙后出血多发生于：牙槽窝感染，感染由病牙根尖炎症扩散或操作不当引起；牙槽窝内有感染的断根或病变的肉芽组织末彻底除净；拔牙后吃了粗糙、刺激性食物，或刷牙破坏了血凝瑰使血凝块凝固不好；血液疾病，如白血病和再生障碍性贫血等。<br /><br /> 所以说，拔牙虽不是什么大事，但如果不加以重视很容易引发严重的后果。若出血为局部炎症引起，可用碘甘油局部涂擦，局部用上海白药粉或其它止血粉和止血海绵压迫。属拔牙断根或有病组织引起的出血，应注射麻药后取去断根，搔刮牙槽窝，去净炎性肉芽组织，必要时严密缝合。拔牙后出血伴有局部红肿、全身发烧者应请医生诊治。</p>,,"拔牙后出血,拔牙后多久不出血,拔牙,",
,拔牙后多久可以进行镶牙呢,拔牙后多久可以进行镶牙呢口腔科医生为您介绍拔智齿牙后多久可以进行镶牙，一般情况下拔完牙后拔牙局部骨组织在拔牙后2-3个月愈合改建基本稳定，拔智齿牙后多久可以进行镶牙一般前牙2个月，后牙3个月此时就可镶牙。拔智齿牙后多久可以进行镶牙通俗地说，就是要等拔牙后留下的伤口愈合了，长平了镶的牙才稳定，牢固如果,<p>　　镶牙是在牙齿拔牙后要进行的牙齿修复，一般拔牙后不是马上就可以做镶牙的，一般镶牙的时间是都不同的。那么拔牙后多久可以进行镶牙呢？现在就让口腔科医生为您介绍拔智齿牙后多久可以进行镶牙。<br /><br /> 　　拔牙后多久可以进行镶牙呢<br /><br /> 　　口腔科医生为您介绍拔智齿牙后多久可以进行镶牙，一般情况下拔完牙后拔牙局部骨组织在拔牙后2-3个月愈合改建基本稳定，拔智齿牙后多久可以进行镶牙一般前牙2个月，后牙3个月此时就可镶牙。拔智齿牙后多久可以进行镶牙通俗地说，就是要等拔牙后留下的伤口愈合了，长平了镶的牙才稳定，牢固如果创口没长好就去装牙。<br /><br /> 　　拔智齿牙后多久可以进行镶牙但是如果年龄偏大或身体体质差需要适当延长，有些老年患者长达半年才能基本愈合。拔智齿牙后多久可以进行镶牙有系统疾病，如糖尿病的患者延长的时间可能更多。另外也要看拔牙的时候创伤的大小、牙根在牙槽骨内的长度，拔牙的时候创伤的小、牙根在牙槽骨内的长度小的恢复快。<br /><br /> 　　以上就是关于拔智齿牙后多久可以进行镶牙的所有内容介绍了，镶牙是在拔牙后在进行的，拔牙后镶牙是需要让牙齿拔牙伤口愈合的，那么您还有什么关于拔智齿牙后进行镶牙的问题想要咨询的请点击在线咨询即可。</p>,<p>　　镶牙是在牙齿拔牙后要进行的牙齿修复，一般拔牙后不是马上就可以做镶牙的，一般镶牙的时间是都不同的。那么拔牙后多久可以进行镶牙呢？现在就让口腔科医生为您介绍拔智齿牙后多久可以进行镶牙。<br /><br /> 　　拔牙后多久可以进行镶牙呢<br /><br /> 　　口腔科医生为您介绍拔智齿牙后多久可以进行镶牙，一般情况下拔完牙后拔牙局部骨组织在拔牙后2-3个月愈合改建基本稳定，拔智齿牙后多久可以进行镶牙一般前牙2个月，后牙3个月此时就可镶牙。拔智齿牙后多久可以进行镶牙通俗地说，就是要等拔牙后留下的伤口愈合了，长平了镶的牙才稳定，牢固如果创口没长好就去装牙。<br /><br /> 　　拔智齿牙后多久可以进行镶牙但是如果年龄偏大或身体体质差需要适当延长，有些老年患者长达半年才能基本愈合。拔智齿牙后多久可以进行镶牙有系统疾病，如糖尿病的患者延长的时间可能更多。另外也要看拔牙的时候创伤的大小、牙根在牙槽骨内的长度，拔牙的时候创伤的小、牙根在牙槽骨内的长度小的恢复快。<br /><br /> 　　以上就是关于拔智齿牙后多久可以进行镶牙的所有内容介绍了，镶牙是在拔牙后在进行的，拔牙后镶牙是需要让牙齿拔牙伤口愈合的，那么您还有什么关于拔智齿牙后进行镶牙的问题想要咨询的请点击在线咨询即可。</p>,,"拔牙后多久可以镶牙,拔牙,",
,怎么拔牙不疼,怎么拔牙不疼 怎么拔牙不疼？在以往的时候，人们只要听说到拔牙就是一件很疼的事情，那是在传统的拔牙方式中，拔蛀牙所造成的巨大的疼痛给人留下了深刻的映像，在经过的人们不断相传之后使我们，人们在听到拔蛀牙时都十分害怕。那么，怎么拔牙不疼？ 怎么拔牙不疼 无痛微创拔牙技术，是一种新型的拔牙方式，通过全景数字,<p> 怎么拔牙不疼？在以往的时候，人们只要听说到拔牙就是一件很疼的事情，那是在传统的拔牙方式中，拔蛀牙所造成的巨大的疼痛给人留下了深刻的映像，在经过的人们不断相传之后使我们，人们在听到拔蛀牙时都十分害怕。那么，怎么拔牙不疼？<br /><br /> 怎么拔牙不疼<br /><br /> 无痛微创拔牙技术，是一种新型的拔牙方式，通过全景数字扫描机对患牙进行全面拍摄，确定患牙位置，然后实施局部麻后，在患者完全没有疼痛的情况下，就可以使牙齿充分松动并且轻轻松松脱出。<br /><br /> 有的患者不仅在拔牙的过程中疼，在拔完蛀牙后也感觉特别疼，究其原因是拔蛀牙过程中造成的创伤太大。新一代拔牙技术不但无痛，更是微创，使得患者即使拔牙完后，也不会感觉到太过明显的疼痛。<br /><br /> 关于怎么拔牙不疼这个问题，医生道：过去拔蛀牙确实很疼，即使打了麻醉药，有些病人也疼的不行，而麻醉药又不能过量使用。但是，现在大家不用担心了，新一代无痛拔牙技术为广大患者很好的解决了拔牙疼这个问题。<br /><br /> 以上就是对怎么拔牙不疼的相关的一些介绍，希望对您有所帮助，拔牙对于专业的口腔医院来说，完全是可以做到无痛拔牙的。</p>,<p> 怎么拔牙不疼？在以往的时候，人们只要听说到拔牙就是一件很疼的事情，那是在传统的拔牙方式中，拔蛀牙所造成的巨大的疼痛给人留下了深刻的映像，在经过的人们不断相传之后使我们，人们在听到拔蛀牙时都十分害怕。那么，怎么拔牙不疼？<br /><br /> 怎么拔牙不疼<br /><br /> 无痛微创拔牙技术，是一种新型的拔牙方式，通过全景数字扫描机对患牙进行全面拍摄，确定患牙位置，然后实施局部麻后，在患者完全没有疼痛的情况下，就可以使牙齿充分松动并且轻轻松松脱出。<br /><br /> 有的患者不仅在拔牙的过程中疼，在拔完蛀牙后也感觉特别疼，究其原因是拔蛀牙过程中造成的创伤太大。新一代拔牙技术不但无痛，更是微创，使得患者即使拔牙完后，也不会感觉到太过明显的疼痛。<br /><br /> 关于怎么拔牙不疼这个问题，医生道：过去拔蛀牙确实很疼，即使打了麻醉药，有些病人也疼的不行，而麻醉药又不能过量使用。但是，现在大家不用担心了，新一代无痛拔牙技术为广大患者很好的解决了拔牙疼这个问题。<br /><br /> 以上就是对怎么拔牙不疼的相关的一些介绍，希望对您有所帮助，拔牙对于专业的口腔医院来说，完全是可以做到无痛拔牙的。</p>,,"怎么拔牙,怎么拔牙不疼,",
,拔智齿有没有危害,拔智齿有没有危害 拔智齿有没有危害 说到智齿大家都知道，而一般长智齿时都会造成阻生，带来很大的危害，因此绝大部分人都会去拔智齿，而拔智齿大家都想知道有没有危害，那么究竟拔智齿有没有危害呢？ 拔智齿有没有危害 口腔科医生表示，拔智齿的主要目的是将影响口腔及身体健康而无法通过治疗保留的患牙给予拔除，智齿,<p> 拔智齿有没有危害 说到智齿大家都知道，而一般长智齿时都会造成阻生，带来很大的危害，因此绝大部分人都会去拔智齿，而拔智齿大家都想知道有没有危害，那么究竟拔智齿有没有危害呢？<br /><br /> 拔智齿有没有危害<br /><br /> 口腔科医生表示，拔智齿的主要目的是将影响口腔及身体健康而无法通过治疗保留的患牙给予拔除，智齿由于其生长时期及生长位置的特殊性，因此极易引发各类口腔及身体问题的发生，加上其他本身是一种多余、痕迹器官，因此很多情况下需进行拔智齿处理。<br /><br /> 拔智齿本身是没有危害的，将生长不良，影响口腔及身体健康的智齿拔除，不仅没有危害，更可避各智齿带来的各种后遗症的发生。如果要说拔智齿的危害，那么则与口腔医院与牙科医师的技术水平有着极大的关系，如果口腔医院与牙科医师的水平不到位，拔智齿常会引发疼痛、出血、感染等情况的发生。<br /><br /> 但是拔智齿一定要到专业的医院。口腔科采用无痛微创拔牙技术，通过全景数字扫描机对患牙进行全面拍摄，确定患牙位置，然后实施局部麻后，在无菌条件下使用特制的加长气压窝轮牙钻，将牙齿牙冠进行分割后，利用微创拔牙器械插入牙周膜与牙槽骨质之间将其分离，在不损伤牙齿周围其它组织的情况下，在没有疼痛的情况下，就可以使牙齿充分松动并且轻轻松松脱出。<br /><br /> 综上所诉，到专业的医院拔智齿是没有危害的，智齿造成阻生及时拔除才能保证口腔健康。</p>,<p> 拔智齿有没有危害 说到智齿大家都知道，而一般长智齿时都会造成阻生，带来很大的危害，因此绝大部分人都会去拔智齿，而拔智齿大家都想知道有没有危害，那么究竟拔智齿有没有危害呢？<br /><br /> 拔智齿有没有危害<br /><br /> 口腔科医生表示，拔智齿的主要目的是将影响口腔及身体健康而无法通过治疗保留的患牙给予拔除，智齿由于其生长时期及生长位置的特殊性，因此极易引发各类口腔及身体问题的发生，加上其他本身是一种多余、痕迹器官，因此很多情况下需进行拔智齿处理。<br /><br /> 拔智齿本身是没有危害的，将生长不良，影响口腔及身体健康的智齿拔除，不仅没有危害，更可避各智齿带来的各种后遗症的发生。如果要说拔智齿的危害，那么则与口腔医院与牙科医师的技术水平有着极大的关系，如果口腔医院与牙科医师的水平不到位，拔智齿常会引发疼痛、出血、感染等情况的发生。<br /><br /> 但是拔智齿一定要到专业的医院。口腔科采用无痛微创拔牙技术，通过全景数字扫描机对患牙进行全面拍摄，确定患牙位置，然后实施局部麻后，在无菌条件下使用特制的加长气压窝轮牙钻，将牙齿牙冠进行分割后，利用微创拔牙器械插入牙周膜与牙槽骨质之间将其分离，在不损伤牙齿周围其它组织的情况下，在没有疼痛的情况下，就可以使牙齿充分松动并且轻轻松松脱出。<br /><br /> 综上所诉，到专业的医院拔智齿是没有危害的，智齿造成阻生及时拔除才能保证口腔健康。</p>,,"拔智齿的危害,拔智齿,",
,拔尽头牙后注意事项有哪些 当天禁忌刷牙,拔尽头牙后注意事项有哪些 当天禁忌刷牙　　牙齿坏死就需要拔牙，尽头牙也是需要拔牙的。尽头牙就是智齿，由于尽头牙常常会有蛀牙。所以我们要拔尽头牙。那么拔尽头牙后注意事项有哪些呢？　　拔尽头牙后注意事项　　口腔科医生介绍，尽头牙是智齿的俗称。尽头牙由于位置的特殊性，极易受到各种牙齿疾病的侵袭以及引发邻近,<p>　　拔尽头牙后注意事项</p><p>　　口腔科医生介绍，尽头牙是智齿的俗称。尽头牙由于位置的特殊性，极易受到各种牙齿疾病的侵袭以及引发邻近牙齿的病变，因此，在威胁口腔及身体健康的情况下，拔尽头牙是我们必须要做的事情。拔尽头牙后注意事项术后的保护是很重的。</p><p>　　首先，拔尽头牙后注意事项是拔尽头牙后医师会在创口处放一消毒棉团，以帮助凝血。毒棉团不宜过早或过迟吐掉，一般在半个小时左右方可吐掉。另外，拔尽头牙后当天一般禁忌刷牙，可适当用漱口替代。这也是拔尽头牙后注意事项。</p><p>　　其次，拔尽头牙后注意事项是拔尽头牙后如果出现异常疼痛，出血等情况，应及时让主师医师进一步诊治。拔尽头牙后2小时内忌食，2小时后方可适当进些流食、半流食及一些易消化食物。同时也不要吃过热及刺激性强的食物。这是拔尽头牙后饮食方面的注意事项。</p><p>　　关于拔尽头牙后注意事项有哪些当天禁忌刷牙的介绍，主要就是这些，我们要牢记拔尽头牙后注意事项，这样有助于拔尽头牙后伤口的愈合。</p>,<p>　　拔尽头牙后注意事项</p><p>　　口腔科医生介绍，尽头牙是智齿的俗称。尽头牙由于位置的特殊性，极易受到各种牙齿疾病的侵袭以及引发邻近牙齿的病变，因此，在威胁口腔及身体健康的情况下，拔尽头牙是我们必须要做的事情。拔尽头牙后注意事项术后的保护是很重的。</p><p>　　首先，拔尽头牙后注意事项是拔尽头牙后医师会在创口处放一消毒棉团，以帮助凝血。毒棉团不宜过早或过迟吐掉，一般在半个小时左右方可吐掉。另外，拔尽头牙后当天一般禁忌刷牙，可适当用漱口替代。这也是拔尽头牙后注意事项。</p><p>　　其次，拔尽头牙后注意事项是拔尽头牙后如果出现异常疼痛，出血等情况，应及时让主师医师进一步诊治。拔尽头牙后2小时内忌食，2小时后方可适当进些流食、半流食及一些易消化食物。同时也不要吃过热及刺激性强的食物。这是拔尽头牙后饮食方面的注意事项。</p><p>　　关于拔尽头牙后注意事项有哪些当天禁忌刷牙的介绍，主要就是这些，我们要牢记拔尽头牙后注意事项，这样有助于拔尽头牙后伤口的愈合。</p>,,"尽头牙,拔牙注意事项,",
