ID,title,abstract,content,content_html,created_at,tag,updated_at
,一般情况下在拔牙前可以吃东西吗,一般情况下在拔牙前可以吃东西吗 说到拔牙，很多人是闻而生畏，为了将拔牙的危害降到最低，是有很多问题是需要注意的。最近在拔牙前是否应该吃东西的问题上，引起了很多争议。下面就口腔科医生为我们解答，一般情况下在拔牙前可以吃东西吗？ 拔牙前可以吃东西吗 口腔科医生表示：拔牙前一定要吃早餐或午餐，因为在打麻药,<p> 说到拔牙，很多人是闻而生畏，为了将拔牙的危害降到最低，是有很多问题是需要注意的。最近在拔牙前是否应该吃东西的问题上，引起了很多争议。下面就口腔科医生为我们解答，一般情况下在拔牙前可以吃东西吗？<br /><br /><br /> 拔牙前可以吃东西吗<br /><br /> 口腔科医生表示：拔牙前一定要吃早餐或午餐，因为在打麻药和拔牙过程中，如果血糖过低，容易引起称之为晕厥的症状，轻微时就像是久蹲后突然起身头晕的表现，严重时会出现意识不清等明显的全身不适而需要急救。<br /><br /> 此外拔牙前高血压病人应服降压药控制血压，并在拔牙前向医生说明高血压病史，待护士测量后确认血压在拔牙允许范围内方可拔牙；而女性比男性情况复杂些，最好是避开月经期。而孕妇因为涉及到胎儿，一般只能在怀孕期的4至6个月才能拔牙，最好是妊娠期结束后再拔牙。<br /><br /> 以上就是口腔科医生关于&ldquo;一般情况下在拔牙前可以吃东西吗&rdquo;的详细解答，相信大家都有了一定的了解。最后医生提醒：拔牙一定要选择正规医院和经验丰富的医生，以免给自己带来危害。</p>,<p> 说到拔牙，很多人是闻而生畏，为了将拔牙的危害降到最低，是有很多问题是需要注意的。最近在拔牙前是否应该吃东西的问题上，引起了很多争议。下面就口腔科医生为我们解答，一般情况下在拔牙前可以吃东西吗？<br /><br /><br /> 拔牙前可以吃东西吗<br /><br /> 口腔科医生表示：拔牙前一定要吃早餐或午餐，因为在打麻药和拔牙过程中，如果血糖过低，容易引起称之为晕厥的症状，轻微时就像是久蹲后突然起身头晕的表现，严重时会出现意识不清等明显的全身不适而需要急救。<br /><br /> 此外拔牙前高血压病人应服降压药控制血压，并在拔牙前向医生说明高血压病史，待护士测量后确认血压在拔牙允许范围内方可拔牙；而女性比男性情况复杂些，最好是避开月经期。而孕妇因为涉及到胎儿，一般只能在怀孕期的4至6个月才能拔牙，最好是妊娠期结束后再拔牙。<br /><br /> 以上就是口腔科医生关于&ldquo;一般情况下在拔牙前可以吃东西吗&rdquo;的详细解答，相信大家都有了一定的了解。最后医生提醒：拔牙一定要选择正规医院和经验丰富的医生，以免给自己带来危害。</p>,,"怎么拔牙,拔牙前要注意什么,",
,一般情况下女性拔牙的最佳时间是什么时候,一般情况下女性拔牙的最佳时间是什么时候 生活中由于对牙齿的保护不周，使得很多人需要进行拔牙，拔牙并不是说拔就拔，它是有很多问题需要注意的，尤其是女性拔牙。下面就让口腔科医生为我们介绍，一般女性拔牙的最佳时间是什么时候？ 女性拔牙的最佳时间 一般女性正处于月经期不要拔牙，因为此时拔牙容易引起出血。拔牙,<p> 生活中由于对牙齿的保护不周，使得很多人需要进行拔牙，拔牙并不是说拔就拔，它是有很多问题需要注意的，尤其是女性拔牙。下面就让口腔科医生为我们介绍，一般女性拔牙的最佳时间是什么时候？<br /><br /><br /> 女性拔牙的最佳时间<br /><br /> 一般女性正处于月经期不要拔牙，因为此时拔牙容易引起出血。拔牙后伤口与唾液接触，伤口愈合缓慢，容易感染。而且服避孕药期间不要拔牙，避孕药可使体内的纤维蛋白分解增加，使伤口不能形成良好的血凝块，病菌容易乘虚而入造成感染，影响伤口愈合。<br /><br /> 此外妊娠期妇女在怀孕的前三个月和后三个月不宜拔牙，因为母亲在这个时期受到刺激，容易造成流产和早产。拔牙后有些人可能需要服用抗菌药，而某些药物会造成不良影响。另外哺乳期不要拔牙，以免药物及其代谢产物可以通过乳汁对婴儿产生影响。<br /><br /> 此外口腔科医生提醒：拔牙一定要选择正规医院和经验丰富的医生，以免给自己带来危害和后顾之忧。</p>,<p> 生活中由于对牙齿的保护不周，使得很多人需要进行拔牙，拔牙并不是说拔就拔，它是有很多问题需要注意的，尤其是女性拔牙。下面就让口腔科医生为我们介绍，一般女性拔牙的最佳时间是什么时候？<br /><br /><br /> 女性拔牙的最佳时间<br /><br /> 一般女性正处于月经期不要拔牙，因为此时拔牙容易引起出血。拔牙后伤口与唾液接触，伤口愈合缓慢，容易感染。而且服避孕药期间不要拔牙，避孕药可使体内的纤维蛋白分解增加，使伤口不能形成良好的血凝块，病菌容易乘虚而入造成感染，影响伤口愈合。<br /><br /> 此外妊娠期妇女在怀孕的前三个月和后三个月不宜拔牙，因为母亲在这个时期受到刺激，容易造成流产和早产。拔牙后有些人可能需要服用抗菌药，而某些药物会造成不良影响。另外哺乳期不要拔牙，以免药物及其代谢产物可以通过乳汁对婴儿产生影响。<br /><br /> 此外口腔科医生提醒：拔牙一定要选择正规医院和经验丰富的医生，以免给自己带来危害和后顾之忧。</p>,,"拔牙的最佳时间,女性拔牙的最佳时间,",
,揭惑：成年人长的最后一颗牙能不能拔掉,揭惑：成年人长的最后一颗牙能不能拔掉 最后一颗牙就是我们常说的智齿，智齿并不像其他牙齿萌出比较容易，它的出现常常令人们困恼不已，所以想要进行拔牙治疗。那么成年人长的最后一颗牙能不能拔掉呢？下面来听听口腔科医生的看法吧！ 最后一颗牙能不能拔 口腔科医生表示：智齿能不能拔由以下几点来决定： 1.如果智齿,<p> 最后一颗牙就是我们常说的智齿，智齿并不像其他牙齿萌出比较容易，它的出现常常令人们困恼不已，所以想要进行拔牙治疗。那么成年人长的最后一颗牙能不能拔掉呢？下面来听听口腔科医生的看法吧！<br /><br /><br /> 最后一颗牙能不能拔<br /><br /> 口腔科医生表示：智齿能不能拔由以下几点来决定：<br /><br /> 1.如果智齿蛀牙，除了很简单的咬合面不深的蛀牙可以补之外，那些邻接面蛀牙，需要很好的技术，以及蛀得很深，甚至需要根管治疗的，一律建议拔除，杜绝后患。<br /><br /> 2.智齿在人类的演化史上，是属于消逝状态。因此牙弓也越来越小，空间不足的情况是很常见的。以萌发的时候最能感觉到肿胀、疼痛感。很多人就是因为不能忍受这种疼痛感，而决定拔掉智齿。<br /><br /> 3.侵犯邻牙：通常患者不自知，而由牙医以X光诊断得知。通常智齿萌发的空间不足，而会倒在第二大臼齿上，因而造成第二大臼齿清洁不易，甚至是牙齿部分吸收的现象，造成患者不舒适或牙疼。<br /><br /> 4.阻生齿：通常这是最讨厌的一种，牙医会觉得很难搞定，但病人却不一定有感觉，因此忽略了。这一种类型的牙齿，通常埋在齿槽骨的里面，如果会痛，或是诊断会有病灶发生的时候，就需要拔除了。</p>,<p> 最后一颗牙就是我们常说的智齿，智齿并不像其他牙齿萌出比较容易，它的出现常常令人们困恼不已，所以想要进行拔牙治疗。那么成年人长的最后一颗牙能不能拔掉呢？下面来听听口腔科医生的看法吧！<br /><br /><br /> 最后一颗牙能不能拔<br /><br /> 口腔科医生表示：智齿能不能拔由以下几点来决定：<br /><br /> 1.如果智齿蛀牙，除了很简单的咬合面不深的蛀牙可以补之外，那些邻接面蛀牙，需要很好的技术，以及蛀得很深，甚至需要根管治疗的，一律建议拔除，杜绝后患。<br /><br /> 2.智齿在人类的演化史上，是属于消逝状态。因此牙弓也越来越小，空间不足的情况是很常见的。以萌发的时候最能感觉到肿胀、疼痛感。很多人就是因为不能忍受这种疼痛感，而决定拔掉智齿。<br /><br /> 3.侵犯邻牙：通常患者不自知，而由牙医以X光诊断得知。通常智齿萌发的空间不足，而会倒在第二大臼齿上，因而造成第二大臼齿清洁不易，甚至是牙齿部分吸收的现象，造成患者不舒适或牙疼。<br /><br /> 4.阻生齿：通常这是最讨厌的一种，牙医会觉得很难搞定，但病人却不一定有感觉，因此忽略了。这一种类型的牙齿，通常埋在齿槽骨的里面，如果会痛，或是诊断会有病灶发生的时候，就需要拔除了。</p>,,"哪一颗牙最后长出来,什么牙最后长出来,",
,智齿发炎牙疼吃什么药有效 能恢复健康,智齿发炎牙疼吃什么药有效 能恢复健康 龋齿，牙髓炎，根尖周炎，牙周炎，智齿发炎等口腔疾病都会引起牙疼。那么智齿发炎牙疼吃什么药有效呢？ 智齿发炎牙疼吃什么药有效 口腔科医生介绍，智齿，学名第三大臼齿，俗称智慧齿、立事牙、尽头牙，是口腔最靠近喉咙的牙齿，如果全部生长出来一共4颗，智齿通常是在人类心智已,<p> 龋齿，牙髓炎，根尖周炎，牙周炎，智齿发炎等口腔疾病都会引起牙疼。那么智齿发炎牙疼吃什么药有效呢？<br /><br /><br /> 智齿发炎牙疼吃什么药有效<br /><br /> 口腔科医生介绍，智齿，学名第三大臼齿，俗称智慧齿、立事牙、尽头牙，是口腔最靠近喉咙的牙齿，如果全部生长出来一共4颗，智齿通常是在人类心智已经趋于成熟时才长出，因而得名。智齿发炎的发病率较高，其危害主要有反复发作的冠周炎、龋齿、下颌疼痛、磨牙、引发三叉神经痛等。而智齿发炎牙疼吃什么药有效不能根治牙疼。<br /><br /> 缓解智齿发炎牙疼，可服用抗生素和消炎止痛药，常用的药物也就是广谱抗生素和甲硝唑等，药店都有卖。这就是智齿发炎牙疼吃什么药有效的主要方法。还可采用局部处理方法，用生理盐水和2％双氧水冲洗局部，再放置碘甘油，每日1-3次，再用洗必泰漱口液漱口。但是这只能暂时的缓解智齿发炎牙疼，并不能根治。<br /><br /> 从智齿发炎牙疼吃什么药有效的介绍中，我们了解到，药物治疗的作用只是暂时的。所以智齿发炎牙疼要到医院治疗。一般智齿发炎牙疼的治疗方法是拔牙。找些有经验的牙医，做好麻醉，拔牙的时候不会有痛楚的，而且再也不用忍受智齿发炎牙疼。另外，我们还要保持口腔清洁。<br /><br /> 以上是智齿发炎牙疼吃什么药有效能恢复健康的介绍。单纯的吃药是无法解决智齿发炎牙疼的，所以我们一定到医院治疗。</p>,<p> 龋齿，牙髓炎，根尖周炎，牙周炎，智齿发炎等口腔疾病都会引起牙疼。那么智齿发炎牙疼吃什么药有效呢？<br /><br /><br /> 智齿发炎牙疼吃什么药有效<br /><br /> 口腔科医生介绍，智齿，学名第三大臼齿，俗称智慧齿、立事牙、尽头牙，是口腔最靠近喉咙的牙齿，如果全部生长出来一共4颗，智齿通常是在人类心智已经趋于成熟时才长出，因而得名。智齿发炎的发病率较高，其危害主要有反复发作的冠周炎、龋齿、下颌疼痛、磨牙、引发三叉神经痛等。而智齿发炎牙疼吃什么药有效不能根治牙疼。<br /><br /> 缓解智齿发炎牙疼，可服用抗生素和消炎止痛药，常用的药物也就是广谱抗生素和甲硝唑等，药店都有卖。这就是智齿发炎牙疼吃什么药有效的主要方法。还可采用局部处理方法，用生理盐水和2％双氧水冲洗局部，再放置碘甘油，每日1-3次，再用洗必泰漱口液漱口。但是这只能暂时的缓解智齿发炎牙疼，并不能根治。<br /><br /> 从智齿发炎牙疼吃什么药有效的介绍中，我们了解到，药物治疗的作用只是暂时的。所以智齿发炎牙疼要到医院治疗。一般智齿发炎牙疼的治疗方法是拔牙。找些有经验的牙医，做好麻醉，拔牙的时候不会有痛楚的，而且再也不用忍受智齿发炎牙疼。另外，我们还要保持口腔清洁。<br /><br /> 以上是智齿发炎牙疼吃什么药有效能恢复健康的介绍。单纯的吃药是无法解决智齿发炎牙疼的，所以我们一定到医院治疗。</p>,,"智齿冠周炎吃什么药,智齿发炎吃什么,",
,智齿发炎怎么办 应该怎么治疗,智齿发炎怎么办 应该怎么治疗 【口腔咨询】：我的嘴巴里面前段时间长了一颗智齿，特别疼，经常引起智齿冠周炎，让我很是痛苦，所以很想知道智齿发炎怎么办 应该怎么治疗？希望医生详细为我解答，谢谢！ 【口腔疾病门诊中心给予回复】 对于智齿发炎，可以采用局部处理的方法，常用生理盐水和2％双氧水冲洗局部，再放置,<p> 【口腔咨询】：我的嘴巴里面前段时间长了一颗智齿，特别疼，经常引起智齿冠周炎，让我很是痛苦，所以很想知道智齿发炎怎么办 应该怎么治疗？希望医生详细为我解答，谢谢！<br /><br /> 【口腔疾病门诊中心给予回复】<br /><br /> 对于智齿发炎，可以采用局部处理的方法，常用生理盐水和2％双氧水冲洗局部，再放置碘甘油，好每日1～3次。如果有脓肿形成，应及时切开排脓。如果出现面颊部红肿热痛，甚至全身发热、疼痛等，可以使用抗生素和消炎止痛药，通过局部药物的处理后，智齿疼的情况就会减轻。对于智齿的反复发作，患者应该痛下决心，对智齿进行拔除，永绝后患。<br /><br /><br /> 智齿</p>,<p> 【口腔咨询】：我的嘴巴里面前段时间长了一颗智齿，特别疼，经常引起智齿冠周炎，让我很是痛苦，所以很想知道智齿发炎怎么办 应该怎么治疗？希望医生详细为我解答，谢谢！<br /><br /> 【口腔疾病门诊中心给予回复】<br /><br /> 对于智齿发炎，可以采用局部处理的方法，常用生理盐水和2％双氧水冲洗局部，再放置碘甘油，好每日1～3次。如果有脓肿形成，应及时切开排脓。如果出现面颊部红肿热痛，甚至全身发热、疼痛等，可以使用抗生素和消炎止痛药，通过局部药物的处理后，智齿疼的情况就会减轻。对于智齿的反复发作，患者应该痛下决心，对智齿进行拔除，永绝后患。<br /><br /><br /> 智齿</p>,,"智齿发炎怎么办,智齿发炎怎么快速止痛,",
,25岁左右的女性长智齿牙疼怎么办,25岁左右的女性长智齿牙疼怎么办 长智齿对很多人来说是一种很普遍的现象，不过智齿比较特殊，它的出现让很多人痛苦不堪。为了解决长智齿患者的烦恼，下面让口腔科医生为我们详细介绍，25岁左右的女性长智齿牙疼怎么办？ 长智齿疼怎么办 口腔科医生表示：一般能正常生长的智齿可以通过服用消炎止痛药来进行止痛，这样,<p> 长智齿对很多人来说是一种很普遍的现象，不过智齿比较特殊，它的出现让很多人痛苦不堪。为了解决长智齿患者的烦恼，下面让口腔科医生为我们详细介绍，25岁左右的女性长智齿牙疼怎么办？<br /><br /><br /> 长智齿疼怎么办<br /><br /> 口腔科医生表示：一般能正常生长的智齿可以通过服用消炎止痛药来进行止痛，这样不仅能够最大程度的减轻患者的疼痛，而且，又还能避免细菌对伤口的伤害，缩小了出现口腔其它疾病的可能性。<br /><br /> 而对于阻生的智齿，建议进行拔除治疗，因为阻生智齿通过对邻牙的摩擦或者刺激正常牙齿组织，会引发一些常见的口腔炎症。因此为了避免阻生智齿带来更多的麻烦，所以，医生为了患者的健康考虑，一般都是建议拔除的。<br /><br /> 所以对于&ldquo;25岁左右的女性长智齿牙疼怎么办&rdquo;的问题，口腔科医生建议长智齿的患者最好是去医院拍个牙片，然后再根据牙齿的生长情况，来决定治疗方案！</p>,<p> 长智齿对很多人来说是一种很普遍的现象，不过智齿比较特殊，它的出现让很多人痛苦不堪。为了解决长智齿患者的烦恼，下面让口腔科医生为我们详细介绍，25岁左右的女性长智齿牙疼怎么办？<br /><br /><br /> 长智齿疼怎么办<br /><br /> 口腔科医生表示：一般能正常生长的智齿可以通过服用消炎止痛药来进行止痛，这样不仅能够最大程度的减轻患者的疼痛，而且，又还能避免细菌对伤口的伤害，缩小了出现口腔其它疾病的可能性。<br /><br /> 而对于阻生的智齿，建议进行拔除治疗，因为阻生智齿通过对邻牙的摩擦或者刺激正常牙齿组织，会引发一些常见的口腔炎症。因此为了避免阻生智齿带来更多的麻烦，所以，医生为了患者的健康考虑，一般都是建议拔除的。<br /><br /> 所以对于&ldquo;25岁左右的女性长智齿牙疼怎么办&rdquo;的问题，口腔科医生建议长智齿的患者最好是去医院拍个牙片，然后再根据牙齿的生长情况，来决定治疗方案！</p>,,"长智齿怎么办,长智齿牙疼怎么办,",
,一般智齿要长多久才能拔掉,一般智齿要长多久才能拔掉 一般智齿要长多久才能拔掉？一个人的口中一共有4颗智齿，但并不是说有的智齿全部都会展长出来。而且有的智齿才&lsquo;小荷才露尖尖角&rsquo;就已经疼痛不已了。那么一般智齿要长多久才能拔掉？下面我们就请口腔科的医生来为大家介绍。 智齿要长多久 一般智齿要长多久才能拔掉？,<p> 一般智齿要长多久才能拔掉？一个人的口中一共有4颗智齿，但并不是说有的智齿全部都会展长出来。而且有的智齿才&lsquo;小荷才露尖尖角&rsquo;就已经疼痛不已了。那么一般智齿要长多久才能拔掉？下面我们就请口腔科的医生来为大家介绍。<br /><br /><br /> 智齿要长多久<br /><br /> 一般智齿要长多久才能拔掉？长智齿一般在18－25岁，从现代医学的观点看，智齿是人类进化的必然。而智齿要好长一段时间才能长出来，一般要半个月左右，待长出来后会感到很不舒服，总觉得有东西碍着，受不了可以考虑找牙医把智齿拔出来。<br /><br /> 如今的新一代拔牙技术又称无痛微创拔牙技术，是一种新型的拔牙方式，通过全景数字扫描机对患牙进行全面拍摄，确定患牙位置，然后实施局部麻后，在无菌条件下使用特制的加长气压窝轮牙钻，将牙齿牙冠进行分割后，利用微创拔牙器械插入牙周膜与牙槽骨质之间将其分离，在不损伤牙齿周围其它组织的情况下，在没有疼痛的情况下，就可以使牙齿充分松动并且轻轻松松脱出。<br /><br /> 传统拔牙方式留给大众最深的印象莫过于&ldquo;疼痛&rdquo;，因此，很多患者宁愿忍受牙痛，也不愿意接受拔牙项目治疗。上海万众医院口腔推出的新一代拔牙技术正规的特点就是无痛，在患者没有有感觉的情况下，牙齿就被从牙槽骨中脱出。<br /><br /> 以上就是口腔科的医生对&lsquo;智齿要长多久&rsquo;的相关报道。对于智齿要长多久是没有一个明确的答案的，主要是因为每个人的口腔结构是不一样的，所以是会有一定的差异的。</p>,<p> 一般智齿要长多久才能拔掉？一个人的口中一共有4颗智齿，但并不是说有的智齿全部都会展长出来。而且有的智齿才&lsquo;小荷才露尖尖角&rsquo;就已经疼痛不已了。那么一般智齿要长多久才能拔掉？下面我们就请口腔科的医生来为大家介绍。<br /><br /><br /> 智齿要长多久<br /><br /> 一般智齿要长多久才能拔掉？长智齿一般在18－25岁，从现代医学的观点看，智齿是人类进化的必然。而智齿要好长一段时间才能长出来，一般要半个月左右，待长出来后会感到很不舒服，总觉得有东西碍着，受不了可以考虑找牙医把智齿拔出来。<br /><br /> 如今的新一代拔牙技术又称无痛微创拔牙技术，是一种新型的拔牙方式，通过全景数字扫描机对患牙进行全面拍摄，确定患牙位置，然后实施局部麻后，在无菌条件下使用特制的加长气压窝轮牙钻，将牙齿牙冠进行分割后，利用微创拔牙器械插入牙周膜与牙槽骨质之间将其分离，在不损伤牙齿周围其它组织的情况下，在没有疼痛的情况下，就可以使牙齿充分松动并且轻轻松松脱出。<br /><br /> 传统拔牙方式留给大众最深的印象莫过于&ldquo;疼痛&rdquo;，因此，很多患者宁愿忍受牙痛，也不愿意接受拔牙项目治疗。上海万众医院口腔推出的新一代拔牙技术正规的特点就是无痛，在患者没有有感觉的情况下，牙齿就被从牙槽骨中脱出。<br /><br /> 以上就是口腔科的医生对&lsquo;智齿要长多久&rsquo;的相关报道。对于智齿要长多久是没有一个明确的答案的，主要是因为每个人的口腔结构是不一样的，所以是会有一定的差异的。</p>,,"智齿什么时候长,智齿多长时间能长出来,",
