ID,title,abstract,content,content_html,created_at,tag,updated_at
,儿童深度龋齿需要拔牙吗？怎么治疗好？,儿童深度龋齿需要拔牙吗？怎么治疗好？医生你好！我儿子今年6岁，还没有换牙，有四颗龋齿，其中有一颗有很大的牙洞，请问：儿童深度龋齿需要拔牙吗？怎么治疗好专家回复：儿童深度龋齿需要拔牙吗？怎么治疗好？你好！龋齿也就是人们常说的蛀牙，是一种发病率极高的牙齿病症。得了龋齿如果不及时治疗的话，会引发牙髓炎，导,<p>医生你好！我儿子今年6岁，还没有换牙，有四颗龋齿，其中有一颗有很大的牙洞，请问：儿童深度龋齿需要拔牙吗？怎么治疗好<br /><br />专家回复：儿童深度龋齿需要拔牙吗？怎么治疗好？<br /><br />你好！龋齿也就是人们常说的蛀牙，是一种发病率极高的牙齿病症。得了龋齿如果不及时治疗的话，会引发牙髓炎，导致牙痛，更严重的还将引发尖周炎、胃肠疾病以及其他病变。孩子乳牙患了龋齿是否需要修补取决于该牙齿离正常换牙时间的长短，也是就说正常的孩子一般是6岁左右换牙，如果孩子3、4的时候就患了龋齿，那么就需要治疗了。因为患龋齿时间长，吃东西会经常的塞牙，易引发根尖炎，如果不治疗的话，新牙质量也会受到影响，这种情况就要考虑进行补牙或者拔牙了。<br /><br />儿童深度龋齿需要拔牙吗？你的孩子也到了该换牙的阶段了，建议你最好是带着孩子到医院检查一下，看是否需要拔牙，以免耽误，影响孩子换新牙。</p>,<p>医生你好！我儿子今年6岁，还没有换牙，有四颗龋齿，其中有一颗有很大的牙洞，请问：儿童深度龋齿需要拔牙吗？怎么治疗好<br /><br />专家回复：儿童深度龋齿需要拔牙吗？怎么治疗好？<br /><br />你好！龋齿也就是人们常说的蛀牙，是一种发病率极高的牙齿病症。得了龋齿如果不及时治疗的话，会引发牙髓炎，导致牙痛，更严重的还将引发尖周炎、胃肠疾病以及其他病变。孩子乳牙患了龋齿是否需要修补取决于该牙齿离正常换牙时间的长短，也是就说正常的孩子一般是6岁左右换牙，如果孩子3、4的时候就患了龋齿，那么就需要治疗了。因为患龋齿时间长，吃东西会经常的塞牙，易引发根尖炎，如果不治疗的话，新牙质量也会受到影响，这种情况就要考虑进行补牙或者拔牙了。<br /><br />儿童深度龋齿需要拔牙吗？你的孩子也到了该换牙的阶段了，建议你最好是带着孩子到医院检查一下，看是否需要拔牙，以免耽误，影响孩子换新牙。</p>,,"儿童深度龋齿,儿童深度龋齿,",
,拔智齿很疼吗？,智齿（Wisdom Tooth）是指人类口腔内，牙槽骨上最里面的上下左右各一的四颗第三磨牙。在智齿的生长方面，个体差异很大，有的人20岁之前，有的人40、50岁才长，有的人终生不长，这都是正常的。在青春期后期，颌骨发育到接近成人大小。但有些人颌骨还不够大，没有足够位置供智齿萌出。智齿就会阻生在颌骨内,<p> 　　智齿（Wisdom Tooth）是指人类口腔内，牙槽骨上最里面的上下左右各一的四颗第三磨牙。在智齿的生长方面，个体差异很大，有的人20岁之前，有的人40、50岁才长，有的人终生不长，这都是正常的。在青春期后期，颌骨发育到接近成人大小。但有些人颌骨还不够大，没有足够位置供智齿萌出。智齿就会阻生在颌骨内，向其他方向生长。可能只有部分牙冠露出牙龈，或完全埋在颌骨里。牙根可能变形或向上颌窦或下颌骨神经所在部位生长，这很危险。<br /><br /> 　　长了智齿，需要找牙科医生咨询一下，有的智齿不用拔除，有的则非拔不可。<br /><br /> 　　如果整牙医生发现智齿是倾斜的，不能顺利萌出，就会建议你尽早拔除。这时智齿的牙根发育尚不完全，拔除创伤小，痛苦小。及早拔除，还可以预防智齿将前牙挤得不整齐。 如果要拔掉智齿，一定要找专业牙科医生。<br /><br /> 　　很多人以为拔牙是很痛苦的，所以心存畏惧，往往消炎后，牙不痛了就得过且过，而对拔牙一拖再拖。其实，对牙科医生来说，智齿并不难拔，长在上面的智齿拔起来更是小菜一碟，熟练的牙医几分钟内即可解决问题。<br /><br /> 　　而且，整牙医生在拔牙前打都会给您打麻醉药，智齿再难拔，痛苦也不会很大。相反，如果消炎后智齿不拔除，就等于姑息养奸，一旦再发炎，引起严重并发症，那才是得不偿失。拔牙后，应该注意些什么呢？<br /><br /> 　　1.一小时内，所有的血水、口水都要吞下。不可漱口，以帮助血液凝结，伤口复原。2.通常拔的时间越久，肿胀的时间也会比较久，尤其是阻生齿。3.回家以后，先冰敷一个小时，之后再不舒适，则用热敷。4.如果有发烧现象，第二天可请病假休息。</p>,<p> 　　智齿（Wisdom Tooth）是指人类口腔内，牙槽骨上最里面的上下左右各一的四颗第三磨牙。在智齿的生长方面，个体差异很大，有的人20岁之前，有的人40、50岁才长，有的人终生不长，这都是正常的。在青春期后期，颌骨发育到接近成人大小。但有些人颌骨还不够大，没有足够位置供智齿萌出。智齿就会阻生在颌骨内，向其他方向生长。可能只有部分牙冠露出牙龈，或完全埋在颌骨里。牙根可能变形或向上颌窦或下颌骨神经所在部位生长，这很危险。<br /><br /> 　　长了智齿，需要找牙科医生咨询一下，有的智齿不用拔除，有的则非拔不可。<br /><br /> 　　如果整牙医生发现智齿是倾斜的，不能顺利萌出，就会建议你尽早拔除。这时智齿的牙根发育尚不完全，拔除创伤小，痛苦小。及早拔除，还可以预防智齿将前牙挤得不整齐。 如果要拔掉智齿，一定要找专业牙科医生。<br /><br /> 　　很多人以为拔牙是很痛苦的，所以心存畏惧，往往消炎后，牙不痛了就得过且过，而对拔牙一拖再拖。其实，对牙科医生来说，智齿并不难拔，长在上面的智齿拔起来更是小菜一碟，熟练的牙医几分钟内即可解决问题。<br /><br /> 　　而且，整牙医生在拔牙前打都会给您打麻醉药，智齿再难拔，痛苦也不会很大。相反，如果消炎后智齿不拔除，就等于姑息养奸，一旦再发炎，引起严重并发症，那才是得不偿失。拔牙后，应该注意些什么呢？<br /><br /> 　　1.一小时内，所有的血水、口水都要吞下。不可漱口，以帮助血液凝结，伤口复原。2.通常拔的时间越久，肿胀的时间也会比较久，尤其是阻生齿。3.回家以后，先冰敷一个小时，之后再不舒适，则用热敷。4.如果有发烧现象，第二天可请病假休息。</p>,,"牙齿拔智齿,痛吗?,拔智齿很疼吗,",
,拔牙后多久可以种植牙,很多人因为牙齿意外缺损或掉落都会想着去做种植牙，因为心急，有的人牙齿刚掉就立马到医院让医生给做植牙手术。这时候医生往往会告诉他不能立马做，需要等大概3个月左右再过来做植牙。这是为什么呢？拔牙后多久可以种植牙？为什么拔牙后不能立即进行植牙呢？口腔医院医生介绍：因为刚拔完牙，牙槽骨会有一个创口，止血后血,<p> 　　很多人因为牙齿意外缺损或掉落都会想着去做种植牙，因为心急，有的人牙齿刚掉就立马到医院让医生给做植牙手术。这时候医生往往会告诉他不能立马做，需要等大概3个月左右再过来做植牙。这是为什么呢？拔牙后多久可以种植牙？<br /><br /> 　　为什么拔牙后不能立即进行植牙呢？口腔医院医生介绍：因为刚拔完牙，牙槽骨会有一个创口，止血后血凝块在里面凝结。时间久了以后创口里面会生长肉芽组织，肉芽组织会慢慢地填平这个创口，创口逐渐会长平，直到创口完全愈合。创口完全愈合后牙槽骨还要有一个吸收的过程，需要大概两个月左右的时间才能稳定。<br /><br /> 　　如果创口没有长好就进行植牙，因为牙槽骨还在吸收的原因，拔牙创口还会发生变化，这时候植牙假牙会与牙龈组织之间出现缝隙，进而导致食物嵌塞、口臭、假牙松动而不稳固，可能需要重新再装。但是拖的时间也不能过久，如果超过半年还不做假牙的话，周围的好牙有可能会或多或少地向缺牙间隙倾斜，造成咀嚼不便。</p>,<p> 　　很多人因为牙齿意外缺损或掉落都会想着去做种植牙，因为心急，有的人牙齿刚掉就立马到医院让医生给做植牙手术。这时候医生往往会告诉他不能立马做，需要等大概3个月左右再过来做植牙。这是为什么呢？拔牙后多久可以种植牙？<br /><br /> 　　为什么拔牙后不能立即进行植牙呢？口腔医院医生介绍：因为刚拔完牙，牙槽骨会有一个创口，止血后血凝块在里面凝结。时间久了以后创口里面会生长肉芽组织，肉芽组织会慢慢地填平这个创口，创口逐渐会长平，直到创口完全愈合。创口完全愈合后牙槽骨还要有一个吸收的过程，需要大概两个月左右的时间才能稳定。<br /><br /> 　　如果创口没有长好就进行植牙，因为牙槽骨还在吸收的原因，拔牙创口还会发生变化，这时候植牙假牙会与牙龈组织之间出现缝隙，进而导致食物嵌塞、口臭、假牙松动而不稳固，可能需要重新再装。但是拖的时间也不能过久，如果超过半年还不做假牙的话，周围的好牙有可能会或多或少地向缺牙间隙倾斜，造成咀嚼不便。</p>,,"拔牙后多久种植牙,拔牙后多久可以镶牙,",
,自己拔牙需要注意什么,患者问：自己拔牙需要注意什么牙科专家：拔牙时需要注意的事项主要有三点：第一点就是要尽量减少对牙周软组织的损伤，把拔牙后留下的创口尽可能缩小，这就要求拔牙操作一定要娴熟，而且熟知牙齿与牙周软组织的依附关系和它们的结构；第二点是要避免对牙槽骨造成损伤，牙槽骨就相当于是牙齿的座位，每一颗牙齿在牙槽骨上都有,<p> 　　患者问：自己拔牙需要注意什么<br /><br /> 　　牙科专家：拔牙时需要注意的事项主要有三点：第一点就是要尽量减少对牙周软组织的损伤，把拔牙后留下的创口尽可能缩小，这就要求拔牙操作一定要娴熟，而且熟知牙齿与牙周软组织的依附关系和它们的结构；第二点是要避免对牙槽骨造成损伤，牙槽骨就相当于是牙齿的座位，每一颗牙齿在牙槽骨上都有相应的位置，拔牙时施力的度和方向把握不好，则有可能会伤到牙槽骨；第三点是拔牙后伤口的止血和消毒，止血不当会造成出血较多，而消毒不彻底则可能引起感染，这个厉害关系，相信大家都比较了解，所以我们一般不建议自行拔牙。 <br /><br /> 　　患者问：拔牙后多长时间做牙模<br /><br /> 　　牙科专家：拔牙后需要等待伤口完成愈合才能够做烤瓷牙（镶牙），这个时间因人而异，一般在一到三个月之间。大家都知道，做烤瓷牙需要一个取模的环节，这个环节一般会选择在拔牙后一个月左右的时间来进行，伤口愈合得快的患者在烤瓷牙设计制作完成（通常是在取模后三到五天）即可进行试戴安装。</p>,<p> 　　患者问：自己拔牙需要注意什么<br /><br /> 　　牙科专家：拔牙时需要注意的事项主要有三点：第一点就是要尽量减少对牙周软组织的损伤，把拔牙后留下的创口尽可能缩小，这就要求拔牙操作一定要娴熟，而且熟知牙齿与牙周软组织的依附关系和它们的结构；第二点是要避免对牙槽骨造成损伤，牙槽骨就相当于是牙齿的座位，每一颗牙齿在牙槽骨上都有相应的位置，拔牙时施力的度和方向把握不好，则有可能会伤到牙槽骨；第三点是拔牙后伤口的止血和消毒，止血不当会造成出血较多，而消毒不彻底则可能引起感染，这个厉害关系，相信大家都比较了解，所以我们一般不建议自行拔牙。 <br /><br /> 　　患者问：拔牙后多长时间做牙模<br /><br /> 　　牙科专家：拔牙后需要等待伤口完成愈合才能够做烤瓷牙（镶牙），这个时间因人而异，一般在一到三个月之间。大家都知道，做烤瓷牙需要一个取模的环节，这个环节一般会选择在拔牙后一个月左右的时间来进行，伤口愈合得快的患者在烤瓷牙设计制作完成（通常是在取模后三到五天）即可进行试戴安装。</p>,,"东莞牙槽骨突出,自己拔牙要注意什么,",
,拔牙镶牙要多少钱,通常医生在拔牙前会设计好镶牙的问题，然后再拔牙，否则，造成镶牙设计上的不便，影响正常口腔功能的恢复。拔牙价格的影响因素：牙齿的位置不同，拔牙的难易程度，拔牙的方法。如果是阻生的智齿，拔牙流程要比一般牙复杂；麻醉的方法有普通局部麻醉，笑气麻醉，笑气麻醉是安全有效的控制疼痛及焦虑的方法，很适合有牙科畏惧,<p> 　　通常医生在拔牙前会设计好镶牙的问题，然后再拔牙，否则，造成镶牙设计上的不便，影响正常口腔功能的恢复。<br /><br /> 　　拔牙价格的影响因素：牙齿的位置不同，拔牙的难易程度，拔牙的方法。如果是阻生的智齿，拔牙流程要比一般牙复杂；麻醉的方法有普通局部麻醉，笑气麻醉，笑气麻醉是安全有效的控制疼痛及焦虑的方法，很适合有牙科畏惧症的患者，进行笑气麻醉后，患者能在清醒的状态下，主动配合医生治疗，笑气麻醉安全可靠，消除患者对口腔治疗过程中的恐惧心理，最大程度的减少治疗带来的疼痛感和不适感，是理想的麻醉方法；拔牙的方法除了传统的拔牙方法，还有先进的CBCT引导下复杂牙的拔除术，是指在口腔锥体束CT引导下，活动口腔清晰影像，重建颌面部形态，精确拔除患牙，拔牙后创伤更小，同时缩短了拔牙后患者的恢复期。<br /><br /> 　　镶牙的价格主要受镶牙材料的影响：镶牙的材料包括：全瓷材料，金属材料，树脂材料。镶牙最好的材料是二氧化锆全瓷牙，运用先进的计算机技术设计结合激光扫描，是高科技的修复方法，透明度好，光泽自然，形态颜色都与真牙十分相似，边缘密合性好，不影响X线、核磁的影像检查，生物相容性极好，在美观和性能上都优于金属修复体，但价格略高一些，适合于对美观要求较高的患者。</p>,<p> 　　通常医生在拔牙前会设计好镶牙的问题，然后再拔牙，否则，造成镶牙设计上的不便，影响正常口腔功能的恢复。<br /><br /> 　　拔牙价格的影响因素：牙齿的位置不同，拔牙的难易程度，拔牙的方法。如果是阻生的智齿，拔牙流程要比一般牙复杂；麻醉的方法有普通局部麻醉，笑气麻醉，笑气麻醉是安全有效的控制疼痛及焦虑的方法，很适合有牙科畏惧症的患者，进行笑气麻醉后，患者能在清醒的状态下，主动配合医生治疗，笑气麻醉安全可靠，消除患者对口腔治疗过程中的恐惧心理，最大程度的减少治疗带来的疼痛感和不适感，是理想的麻醉方法；拔牙的方法除了传统的拔牙方法，还有先进的CBCT引导下复杂牙的拔除术，是指在口腔锥体束CT引导下，活动口腔清晰影像，重建颌面部形态，精确拔除患牙，拔牙后创伤更小，同时缩短了拔牙后患者的恢复期。<br /><br /> 　　镶牙的价格主要受镶牙材料的影响：镶牙的材料包括：全瓷材料，金属材料，树脂材料。镶牙最好的材料是二氧化锆全瓷牙，运用先进的计算机技术设计结合激光扫描，是高科技的修复方法，透明度好，光泽自然，形态颜色都与真牙十分相似，边缘密合性好，不影响X线、核磁的影像检查，生物相容性极好，在美观和性能上都优于金属修复体，但价格略高一些，适合于对美观要求较高的患者。</p>,,"拔牙镶牙多少钱,拔牙多少钱,",
,多生牙拔牙多少钱,多生牙拔牙多少钱　　整齐洁白的牙齿是很多人想拥有的，但由于先天或后天的因素，牙齿会出现各种问题，多生牙也称额外牙，是指正常牙齿数目外长出的牙，常见于替牙期的混合牙列及恒牙列，呈圆柱形或圆锥形，大多发生在上颌的前牙区。那么，多生牙拔牙多少钱呢？　　发现多生牙后应该及早治疗，否则会影响恒牙列的生长，多生,<p>　　整齐洁白的牙齿是很多人想拥有的，但由于先天或后天的因素，牙齿会出现各种问题，多生牙也称额外牙，是指正常牙齿数目外长出的牙，常见于替牙期的混合牙列及恒牙列，呈圆柱形或圆锥形，大多发生在上颌的前牙区。那么，多生牙拔牙多少钱呢？<br /><br />　　发现多生牙后应该及早治疗，否则会影响恒牙列的生长，多生牙额外增加了牙弓的牙量，引起错位或阻萌。多生牙的价格是根据患者具体情况，多生牙结构位置的不同，拔牙的难易程度，拔牙的方法以及拔牙选择的医院。<br /><br />　　通常拔牙前医生会对患者的口腔做全面检查，每个人的口腔情况不同，有炎症的需要先消炎，具体多少钱要看患者本人的实际情况，根据个人的牙齿现状做出判断，因人而异，现在比较先进的拔牙方法是微创拔牙系统法，在患者基本没用痛感的状态下分离牙齿，拔除各种复杂牙，这种方法对周围组织的损伤极小，降低了患者对拔牙的恐惧感，但价格要比传统拔牙术贵一些。<br /><br />　　拔牙一定要选择正规的口腔医院，拔牙不慎会造成局部组织的损伤，引起出血，肿胀，疼痛等问题的产生，一定要慎重对待。</p>,<p>　　整齐洁白的牙齿是很多人想拥有的，但由于先天或后天的因素，牙齿会出现各种问题，多生牙也称额外牙，是指正常牙齿数目外长出的牙，常见于替牙期的混合牙列及恒牙列，呈圆柱形或圆锥形，大多发生在上颌的前牙区。那么，多生牙拔牙多少钱呢？<br /><br />　　发现多生牙后应该及早治疗，否则会影响恒牙列的生长，多生牙额外增加了牙弓的牙量，引起错位或阻萌。多生牙的价格是根据患者具体情况，多生牙结构位置的不同，拔牙的难易程度，拔牙的方法以及拔牙选择的医院。<br /><br />　　通常拔牙前医生会对患者的口腔做全面检查，每个人的口腔情况不同，有炎症的需要先消炎，具体多少钱要看患者本人的实际情况，根据个人的牙齿现状做出判断，因人而异，现在比较先进的拔牙方法是微创拔牙系统法，在患者基本没用痛感的状态下分离牙齿，拔除各种复杂牙，这种方法对周围组织的损伤极小，降低了患者对拔牙的恐惧感，但价格要比传统拔牙术贵一些。<br /><br />　　拔牙一定要选择正规的口腔医院，拔牙不慎会造成局部组织的损伤，引起出血，肿胀，疼痛等问题的产生，一定要慎重对待。</p>,,"多生牙拔牙,拔牙多少钱,",
,牙痛的时候可以拔牙吗,网友咨询：有个牙齿只剩一点残根，由于实在不能保留，为了口腔的健康准备到医院拔除，但左上面还有一颗牙齿存在炎症疼痛的特别难受，不知道牙痛的时候可以拔牙吗？专家回答：此种情况一般是不建议拔牙的，应先消除口腔炎症，待炎症消除后再进行拔牙处理，毕竟若炎症不消除就拔牙易导致创口感染，给患者带来不必要的麻烦。总,<p> 　　网友咨询：有个牙齿只剩一点残根，由于实在不能保留，为了口腔的健康准备到医院拔除，但左上面还有一颗牙齿存在炎症疼痛的特别难受，不知道牙痛的时候可以拔牙吗？<br /><br /> 　　专家回答：此种情况一般是不建议拔牙的，应先消除口腔炎症，待炎症消除后再进行拔牙处理，毕竟若炎症不消除就拔牙易导致创口感染，给患者带来不必要的麻烦。<br /><br /> 　　总之在牙齿存在炎症疼痛的时候是不建议拔牙的，应治疗相应的疾病，待炎症消除后再拔牙。至于牙痛如何治疗视个人牙齿情况而定，因为不同的人引起牙痛的原因不同，当然所采取的诊疗方法不同，若是龋齿引起的牙痛，常通过补牙或根管治疗恢复牙齿的形态和功能；若牙髓炎或根尖周炎引起的牙痛常需进行根管治疗。</p>,<p> 　　网友咨询：有个牙齿只剩一点残根，由于实在不能保留，为了口腔的健康准备到医院拔除，但左上面还有一颗牙齿存在炎症疼痛的特别难受，不知道牙痛的时候可以拔牙吗？<br /><br /> 　　专家回答：此种情况一般是不建议拔牙的，应先消除口腔炎症，待炎症消除后再进行拔牙处理，毕竟若炎症不消除就拔牙易导致创口感染，给患者带来不必要的麻烦。<br /><br /> 　　总之在牙齿存在炎症疼痛的时候是不建议拔牙的，应治疗相应的疾病，待炎症消除后再拔牙。至于牙痛如何治疗视个人牙齿情况而定，因为不同的人引起牙痛的原因不同，当然所采取的诊疗方法不同，若是龋齿引起的牙痛，常通过补牙或根管治疗恢复牙齿的形态和功能；若牙髓炎或根尖周炎引起的牙痛常需进行根管治疗。</p>,,"牙痛的时候拔牙,牙痛可以拔牙吗,",
,拔牙后多久可以吃饭,拔牙术是对于牙病不能治愈保留的患牙，埋伏齿，病灶牙等情况的治疗技术，拔牙需要掌握严格的适应症，当牙齿影响正常健康，而又没有有效的方法可以保留时，才考虑拔除。对于一些有全身疾病的患者需要注意：血液病，心血管病，甲亢，糖尿病，肝肾病，急性传染病期，恶性肿瘤的患者，需要先控制病情，采取相应措施，谨慎拔牙。,<p> 　　拔牙术是对于牙病不能治愈保留的患牙，埋伏齿，病灶牙等情况的治疗技术，拔牙需要掌握严格的适应症，当牙齿影响正常健康，而又没有有效的方法可以保留时，才考虑拔除。<br /><br /> 　　对于一些有全身疾病的患者需要注意：血液病，心血管病，甲亢，糖尿病，肝肾病，急性传染病期，恶性肿瘤的患者，需要先控制病情，采取相应措施，谨慎拔牙。拔牙最好选择上午去拔，特别是复杂牙齿，下午拔牙麻药的吸收程度不太好，在拔牙时痛感更强一些，另外，女性拔牙着注意要错开例假期。<br /><br /> 　　拔牙后2个小时可以进食，以流质食物为主，注意不要吃较硬较热的食物，使用未拔牙侧，防止破坏血凝块而出血。拔牙后尽量休息，不要多做运动或重体力劳动，不要洗热水澡，以免创口出血。</p>,<p> 　　拔牙术是对于牙病不能治愈保留的患牙，埋伏齿，病灶牙等情况的治疗技术，拔牙需要掌握严格的适应症，当牙齿影响正常健康，而又没有有效的方法可以保留时，才考虑拔除。<br /><br /> 　　对于一些有全身疾病的患者需要注意：血液病，心血管病，甲亢，糖尿病，肝肾病，急性传染病期，恶性肿瘤的患者，需要先控制病情，采取相应措施，谨慎拔牙。拔牙最好选择上午去拔，特别是复杂牙齿，下午拔牙麻药的吸收程度不太好，在拔牙时痛感更强一些，另外，女性拔牙着注意要错开例假期。<br /><br /> 　　拔牙后2个小时可以进食，以流质食物为主，注意不要吃较硬较热的食物，使用未拔牙侧，防止破坏血凝块而出血。拔牙后尽量休息，不要多做运动或重体力劳动，不要洗热水澡，以免创口出血。</p>,,"拔牙后多久可以吃饭,拔牙,",
