ID,title,abstract,content,content_html,created_at,tag,updated_at
,专家提醒六类智齿应该尽早拔掉,随着人类进化，颌骨的体积越来越小，往往没有足够的空间让一些智齿萌出或生长，导致方向异常给人带来诸多的口腔健康隐患。专家指出，以下六类智齿应尽快拔掉。1.蛀牙:如果智齿出现比较深的蛀牙，特别是需要根管治疗的。2.侵犯邻牙:如果生长空间不足，智齿会使劲儿顶住相邻的牙齿继续生长，可能保不住两颗牙齿。3.空,<p>随着人类进化，颌骨的体积越来越小，往往没有足够的空间让一些智齿萌出或生长，导致方向异常给人带来诸多的口腔健康隐患。专家指出，以下六类智齿应尽快拔掉。</p><p>1.蛀牙:如果智齿出现比较深的蛀牙，特别是需要根管治疗的。</p><p>2.侵犯邻牙:如果生长空间不足，智齿会使劲儿顶住相邻的牙齿继续生长，可能保不住两颗牙齿。</p><p>3.空间不足:在智齿生长过程中空间，会出现比较严重的牙龈肿胀、牙齿疼痛等症状。</p><p>4.不易清洁:长得歪七扭八的智齿，清洁起来会比较困难，很容易出现蛀牙。</p><p>5.没有对咬牙:如果一颗智齿的对面没有与之相抗衡的另一颗智齿，可能影响人的咬合关系。</p><p>6.阻生齿:这种类型的智齿，通常埋在齿槽骨的里面，当你感觉到痛时就要拔掉。</p><p>有些人的智齿早就该拔掉了，但是他们认为只要智齿没有引起疼痛，就不必治疗或拔除。这种看法是不对的。一旦出现牙痛等症状，就表明智齿的存在已经对其他牙齿造成了不可逆转的损害，此时再拔掉智齿，多少有点儿亡羊补牢的意思。还有些人害怕拔牙疼痛而迟迟不愿到牙科就诊。</p><p>为什么要拔掉智齿</p><p>首先，如果智齿不能完全生长出来，其牙冠就会被牙龈覆盖住然后形成冠周袋。冠周袋很容易积存食物残渣和细菌，导致智齿冠周炎反复发作，牙痛、张口受限、进食困难等症状的出现。</p><p>其次，如果智齿长歪了，和相邻的牙齿出现一个夹角，容易导致食物嵌塞，时间久了，智齿和相邻的牙齿都容易出现蛀牙甚至是牙髓炎。</p><p>第三，如果智齿生长的位置和方向出现异常，还会影响上下牙齿之间的咬合关系，可能造成颞下颌关节弹响、张口疼痛、夜磨牙等。</p><p>其实，在局部麻醉下，患者在拔牙过程中是不会感觉到疼痛的。在智齿刚刚萌出、牙根尚未完全形成时，就应该拔掉该拔的智齿。</p><p>拔牙最好选择正规专业的牙科医院，让自己放心多一点，健康多一点。如果存在有不清楚的地方，欢迎咨询我们的在线专家。</p>,<p>随着人类进化，颌骨的体积越来越小，往往没有足够的空间让一些智齿萌出或生长，导致方向异常给人带来诸多的口腔健康隐患。专家指出，以下六类智齿应尽快拔掉。</p><p>1.蛀牙:如果智齿出现比较深的蛀牙，特别是需要根管治疗的。</p><p>2.侵犯邻牙:如果生长空间不足，智齿会使劲儿顶住相邻的牙齿继续生长，可能保不住两颗牙齿。</p><p>3.空间不足:在智齿生长过程中空间，会出现比较严重的牙龈肿胀、牙齿疼痛等症状。</p><p>4.不易清洁:长得歪七扭八的智齿，清洁起来会比较困难，很容易出现蛀牙。</p><p>5.没有对咬牙:如果一颗智齿的对面没有与之相抗衡的另一颗智齿，可能影响人的咬合关系。</p><p>6.阻生齿:这种类型的智齿，通常埋在齿槽骨的里面，当你感觉到痛时就要拔掉。</p><p>有些人的智齿早就该拔掉了，但是他们认为只要智齿没有引起疼痛，就不必治疗或拔除。这种看法是不对的。一旦出现牙痛等症状，就表明智齿的存在已经对其他牙齿造成了不可逆转的损害，此时再拔掉智齿，多少有点儿亡羊补牢的意思。还有些人害怕拔牙疼痛而迟迟不愿到牙科就诊。</p><p>为什么要拔掉智齿</p><p>首先，如果智齿不能完全生长出来，其牙冠就会被牙龈覆盖住然后形成冠周袋。冠周袋很容易积存食物残渣和细菌，导致智齿冠周炎反复发作，牙痛、张口受限、进食困难等症状的出现。</p><p>其次，如果智齿长歪了，和相邻的牙齿出现一个夹角，容易导致食物嵌塞，时间久了，智齿和相邻的牙齿都容易出现蛀牙甚至是牙髓炎。</p><p>第三，如果智齿生长的位置和方向出现异常，还会影响上下牙齿之间的咬合关系，可能造成颞下颌关节弹响、张口疼痛、夜磨牙等。</p><p>其实，在局部麻醉下，患者在拔牙过程中是不会感觉到疼痛的。在智齿刚刚萌出、牙根尚未完全形成时，就应该拔掉该拔的智齿。</p><p>拔牙最好选择正规专业的牙科医院，让自己放心多一点，健康多一点。如果存在有不清楚的地方，欢迎咨询我们的在线专家。</p>,,"智齿,蛀牙,",
,拔牙禁忌及术前面准备,拔牙前应慎重考虑的某些全身疾病：如下列一些疾病，应特别注意其拔牙后果，最好是先经过有关科室会诊检查，采取适当治疗措施，再决定是否适于拔牙。1．血液病 如血友病、再生障碍性贫血、血小板减少性紫瘢、白血病等伴有凝血障碍，拔牙后可因出血不止而危及生命。如必须拔牙，应在住院和内科协作条件下，采取有效防治出血,<p>1．血液病 如血友病、再生障碍性贫血、血小板减少性紫瘢、白血病等伴有凝血障碍，拔牙后可因出血不止而危及生命。如必须拔牙，应在住院和内科协作条件下，采取有效防治出血措施，然后进行拔牙。<br /><br />2．心血管疾病 如高血压、心脏病病员，应事先了解其病情轻重、性质，是否经内科治疗得到控制，然后考虑拔牙时机。决定拔牙时还应分别不同情况给予术前术后药物，以防意外。<br /><br />3．其它慢性病如严重糖尿病、肺结核、肝肾疾患等病员，应经内科治疗待病情好转后再考虑拔牙。<br /><br />4．急性传染病、口腔粘膜急性炎症、口腔恶性肿瘤病员在决定治疗方案前，均不宜拔牙，以免引起病情加重，肿瘤扩散等后果。<br /><br />5．妊娠期 在怀孕前三个月和后二个月内，为了避免引起流产和早产，水宜拔牙。妇女月经期一般暂缓拔牙。<br /><br />6．全身健康情况较差，或在饥饿、疲劳、睡眠不足等情况下，最好暂缓拔牙。<br /><br />拔牙术前准备<br /><br />1．术者要认真检查核对：①拔那个牙？②为什么拔牙？③现在能不能拔？作到心中有数，并对病员解释清楚，解除病员顾虑。<br /><br />2．调整椅位，对好光源，使病员位置舒适，手术野暴露清楚，便于手术操作。<br /><br />3．准备拔牙器械：常用的拔牙器械有牙龈分离器、牙挺、牙钳和刮匙等（见图5－8）。拔牙钳为适应牙齿的形态和部位不同，有各种不同类型，拔牙应根据所拔牙齿选用。</p>,<p>1．血液病 如血友病、再生障碍性贫血、血小板减少性紫瘢、白血病等伴有凝血障碍，拔牙后可因出血不止而危及生命。如必须拔牙，应在住院和内科协作条件下，采取有效防治出血措施，然后进行拔牙。<br /><br />2．心血管疾病 如高血压、心脏病病员，应事先了解其病情轻重、性质，是否经内科治疗得到控制，然后考虑拔牙时机。决定拔牙时还应分别不同情况给予术前术后药物，以防意外。<br /><br />3．其它慢性病如严重糖尿病、肺结核、肝肾疾患等病员，应经内科治疗待病情好转后再考虑拔牙。<br /><br />4．急性传染病、口腔粘膜急性炎症、口腔恶性肿瘤病员在决定治疗方案前，均不宜拔牙，以免引起病情加重，肿瘤扩散等后果。<br /><br />5．妊娠期 在怀孕前三个月和后二个月内，为了避免引起流产和早产，水宜拔牙。妇女月经期一般暂缓拔牙。<br /><br />6．全身健康情况较差，或在饥饿、疲劳、睡眠不足等情况下，最好暂缓拔牙。<br /><br />拔牙术前准备<br /><br />1．术者要认真检查核对：①拔那个牙？②为什么拔牙？③现在能不能拔？作到心中有数，并对病员解释清楚，解除病员顾虑。<br /><br />2．调整椅位，对好光源，使病员位置舒适，手术野暴露清楚，便于手术操作。<br /><br />3．准备拔牙器械：常用的拔牙器械有牙龈分离器、牙挺、牙钳和刮匙等（见图5－8）。拔牙钳为适应牙齿的形态和部位不同，有各种不同类型，拔牙应根据所拔牙齿选用。</p>,,"拔牙禁忌,拔牙,",
,拔牙后多久可以装假牙?,拔牙后多久可以装假牙?拔牙后多久可以装假牙?在牙齿松动、蛀坏的情况下，需要患者拔掉残齿安装假牙修复，拔牙后牙齿缺失不仅影响口腔美观还会造成牙齿咀嚼功能的不便，因此很多患者在拔牙后都需要安装假牙治疗，那么拔牙后多久可以装假牙?拔牙后多久可以装假牙?口腔专家表示拔牙后多久可以装假牙还需要根据所镶牙齿种类,<p>拔牙后多久可以装假牙?在牙齿松动、蛀坏的情况下，需要患者拔掉残齿安装假牙修复，拔牙后牙齿缺失不仅影响口腔美观还会造成牙齿咀嚼功能的不便，因此很多患者在拔牙后都需要安装假牙治疗，那么拔牙后多久可以装假牙?<br /><br />拔牙后多久可以装假牙?口腔专家表示拔牙后多久可以装假牙还需要根据所镶牙齿种类不同来分析，并不是说任何一种镶牙时间都一样，具体可分为以下几类：<br /><br />1、过渡性义齿(即刻义齿)：拔牙后30分钟就可以戴假牙，主要适用于对美观要求较高的前牙临时遮丑用。做这种假牙，拔牙前就取好模型。先在模型上做好假牙，拔牙后可以立刻戴牙。这种假牙与拔牙处不密合所以固位效果、远期效果都较差，待拔牙创完全愈合后还需重做。<br /><br />2、活动假牙：一般在一次该拔的牙分次拔除的最后一次拔牙后2-3个月(残根等要根据具体情况而改变时间，如牙根很短，甚至在拔牙后1个月左右就可以镶牙)。活动义齿精密度要求不需要太高，牙槽骨吸收基本平稳时就可以镶牙，以后只需要复诊做一下适当调整就可以。<br /><br />口腔专家介绍：一般都需要在3个月后才能镶牙，因为在拔牙后两周，牙槽内有骨组织生长，最后形成骨组织。在血块机化的同时，牙龈上皮由周围向血块表面生长，最后完全覆盖整个创面。一般大约要1-2个月牙槽窝才完全长平，并伴有新骨生长，3个月后牙槽窝完全被新骨所充填。</p>,<p>拔牙后多久可以装假牙?在牙齿松动、蛀坏的情况下，需要患者拔掉残齿安装假牙修复，拔牙后牙齿缺失不仅影响口腔美观还会造成牙齿咀嚼功能的不便，因此很多患者在拔牙后都需要安装假牙治疗，那么拔牙后多久可以装假牙?<br /><br />拔牙后多久可以装假牙?口腔专家表示拔牙后多久可以装假牙还需要根据所镶牙齿种类不同来分析，并不是说任何一种镶牙时间都一样，具体可分为以下几类：<br /><br />1、过渡性义齿(即刻义齿)：拔牙后30分钟就可以戴假牙，主要适用于对美观要求较高的前牙临时遮丑用。做这种假牙，拔牙前就取好模型。先在模型上做好假牙，拔牙后可以立刻戴牙。这种假牙与拔牙处不密合所以固位效果、远期效果都较差，待拔牙创完全愈合后还需重做。<br /><br />2、活动假牙：一般在一次该拔的牙分次拔除的最后一次拔牙后2-3个月(残根等要根据具体情况而改变时间，如牙根很短，甚至在拔牙后1个月左右就可以镶牙)。活动义齿精密度要求不需要太高，牙槽骨吸收基本平稳时就可以镶牙，以后只需要复诊做一下适当调整就可以。<br /><br />口腔专家介绍：一般都需要在3个月后才能镶牙，因为在拔牙后两周，牙槽内有骨组织生长，最后形成骨组织。在血块机化的同时，牙龈上皮由周围向血块表面生长，最后完全覆盖整个创面。一般大约要1-2个月牙槽窝才完全长平，并伴有新骨生长，3个月后牙槽窝完全被新骨所充填。</p>,,"拔牙后多久可以镶牙,拔牙,",
,拔了智齿要注意什么,拔了智齿要注意什么？口腔牙科专家告诉我们，拔了智齿需要注意以下几点：1、咬住消毒棉球。适度咬住棉球压迫伤口半小时后才能吐掉2、拔了智齿两小时后才能进食，先吃些偏软的食物，食物温度不宜过热或者过冷，以免对伤口带来刺激3、拔了智齿后24小时内一般不建议漱口，更不要刷牙。以免刺激伤口，造成再度出血。还需注,<p>口腔牙科专家告诉我们，拔了智齿需要注意以下几点：<br /><br />1、咬住消毒棉球。适度咬住棉球压迫伤口半小时后才能吐掉<br /><br />2、拔了智齿两小时后才能进食，先吃些偏软的食物，食物温度不宜过热或者过冷，以免对伤口带来刺激<br /><br />3、拔了智齿后24小时内一般不建议漱口，更不要刷牙。以免刺激伤口，造成再度出血。还需注意尽量不要用舌头去舔伤口或者吮吸伤口。<br /><br />4、一周内尽量不要吸烟、饮酒或者吃辛辣等对伤口有较强刺激性的食物，更不要用未经消毒的棉球、牙粉等去接触伤口，以免引起感染。<br /><br />5、拔了智齿后会有疼痛感，可在医生的指导下酌情服用去痛片。 </p>,<p>口腔牙科专家告诉我们，拔了智齿需要注意以下几点：<br /><br />1、咬住消毒棉球。适度咬住棉球压迫伤口半小时后才能吐掉<br /><br />2、拔了智齿两小时后才能进食，先吃些偏软的食物，食物温度不宜过热或者过冷，以免对伤口带来刺激<br /><br />3、拔了智齿后24小时内一般不建议漱口，更不要刷牙。以免刺激伤口，造成再度出血。还需注意尽量不要用舌头去舔伤口或者吮吸伤口。<br /><br />4、一周内尽量不要吸烟、饮酒或者吃辛辣等对伤口有较强刺激性的食物，更不要用未经消毒的棉球、牙粉等去接触伤口，以免引起感染。<br /><br />5、拔了智齿后会有疼痛感，可在医生的指导下酌情服用去痛片。 </p>,,"拔了智齿要注意什么,拔牙要注意什么,",
,微创拔牙的优点,拔牙向来是口腔患者最害怕的治疗手术，不用说看到冰冷的拔牙钳，听到锤子的敲击声，单单是打个麻药也有人害怕。现在有了微创拔牙，避免了疼痛，让患者体验了&ldquo;舒适治疗&rdquo;的轻松、安全和高效，有心脏病的儿童也适用微创拔牙。微创拔牙的优势总结起来有6点： 1、疼痛轻：无痛微创拔牙术中几乎没有,<p>2、创伤小：高速涡轮钻能准确地去骨、分割牙体，使拔除容易，患者局部损伤小。<br /><br />3、创口愈合快：由于精细器械的使用，伤口创伤小，降低感染机会，创口愈合快。<br /><br />4、时间短：微创拔牙手术视野清楚，减少使用骨凿去骨的时间，是传统拔牙时间的1/3左右。<br /><br />5、并发症少：微创拔牙术后出血、肿胀、疼痛、神经损伤、感染、张口受限、颞颌关节损伤等拔牙并发症明显减少。<br /><br />6、心理影响较小：由于微创拔牙手术过程没有传统拔牙敲、凿等恐怖动作，不会使患者尤其是儿童、老年人产生恐惧感，对患者心理影响也小很多。<br /><br /> 因此，口腔医院专家郑重提醒广大市民：微创拔牙对于拔除智齿现在是常用的技术，非常成熟、可靠、安全，需要拔牙并且希望拔牙创伤小的市民应该优先考虑微创拔牙。</p>,<p>2、创伤小：高速涡轮钻能准确地去骨、分割牙体，使拔除容易，患者局部损伤小。<br /><br />3、创口愈合快：由于精细器械的使用，伤口创伤小，降低感染机会，创口愈合快。<br /><br />4、时间短：微创拔牙手术视野清楚，减少使用骨凿去骨的时间，是传统拔牙时间的1/3左右。<br /><br />5、并发症少：微创拔牙术后出血、肿胀、疼痛、神经损伤、感染、张口受限、颞颌关节损伤等拔牙并发症明显减少。<br /><br />6、心理影响较小：由于微创拔牙手术过程没有传统拔牙敲、凿等恐怖动作，不会使患者尤其是儿童、老年人产生恐惧感，对患者心理影响也小很多。<br /><br /> 因此，口腔医院专家郑重提醒广大市民：微创拔牙对于拔除智齿现在是常用的技术，非常成熟、可靠、安全，需要拔牙并且希望拔牙创伤小的市民应该优先考虑微创拔牙。</p>,,"微创拔牙,拔牙,",
,智齿拔除（病例）,患者女性，年龄：27岁，因右下后牙胀痛不适，前来诊治。经检查发现右下颌长一智齿，智齿前倾位，未完全萌出，周围粘膜红肿，压痛明显。龈袋内嵌塞大量食物残渣。建议患者消炎待阻生牙无痛拔除术。拔除右下阻生牙后患者无感觉不适。半年后，患者左侧出现类似症状，同上次治疗方案，拔除左侧近中阻生牙。图一：右侧智齿口内,"患者女性，年龄：27岁，因右下后牙胀痛不适，前来诊治。经检查发现右下颌长一智齿，智齿前倾位，未完全萌出，周围粘膜红肿，压痛明显。龈袋内嵌塞大量食物残渣。建议患者消炎待阻生牙无痛拔除术。拔除右下阻生牙后患者无感觉不适。半年后，患者左侧出现类似症状，同上次治疗方案，拔除左侧近中阻生牙。</p>有下列合并症的智齿应予拔除：<br style=""font-family: 宋体;"" />1、没有咀嚼功能，而且经常咬破颊黏膜的颊向位阻生智齿，有<br style=""font-family: 宋体;"" />可能成为导致颊黏膜破溃、感染、糜烂，甚至成为癌前病变的病灶牙，<br style=""font-family: 宋体;"" />应早期拔除。<br style=""font-family: 宋体;"" />2、经常并发急、慢性冠周炎的低位垂直阻生智齿，已成影响身<br style=""font-family: 宋体;"" />体健康的病灶牙，应予拔除。<br style=""font-family: 宋体;"" />3、近中倾斜阻生智齿，虽暂无症状，但该智齿的存在可造成第<br style=""font-family: 宋体;"" />二磨牙的远中邻面牙颈部龋洞。为了保护有重要咀嚼功能的第二磨牙，<br style=""font-family: 宋体;"" />主张早期拔除此类阻生智齿。<br style=""font-family: 宋体;"" />除此之外，对于其他牙位正常、有咀嚼功能的智齿；或虽阻生，也<br style=""font-family: 宋体;"" />没有咀嚼功能，但无不适、发炎、龋齿等并发症的智齿；或可利用它作<br style=""font-family: 宋体;"" />为义齿（假牙）修复时担当基牙的智齿，均应予以保留</p><p style=""font-family: 宋体; padding: 0px; border-width: 0px; margin: 0px; color: rgb(51, 51, 51); font-size: 12px; font-style: normal; font-variant: normal; font-weight: normal; letter-spacing: normal; line-height: 28px; orphans: auto; text-align: start; text-indent: 0px; text-transform: none; white-space: normal; widows: auto; word-spacing: 0px; -webkit-text-stroke-width: 0px; background-color: rgb(255, 255, 255);"">如果要拔掉智齿，一定要找专业牙医，否则，一旦造成下颌神经或邻牙的损伤则为时过晚了。</p>","患者女性，年龄：27岁，因右下后牙胀痛不适，前来诊治。经检查发现右下颌长一智齿，智齿前倾位，未完全萌出，周围粘膜红肿，压痛明显。龈袋内嵌塞大量食物残渣。建议患者消炎待阻生牙无痛拔除术。拔除右下阻生牙后患者无感觉不适。半年后，患者左侧出现类似症状，同上次治疗方案，拔除左侧近中阻生牙。</p>有下列合并症的智齿应予拔除：<br style=""font-family: 宋体;"" />1、没有咀嚼功能，而且经常咬破颊黏膜的颊向位阻生智齿，有<br style=""font-family: 宋体;"" />可能成为导致颊黏膜破溃、感染、糜烂，甚至成为癌前病变的病灶牙，<br style=""font-family: 宋体;"" />应早期拔除。<br style=""font-family: 宋体;"" />2、经常并发急、慢性冠周炎的低位垂直阻生智齿，已成影响身<br style=""font-family: 宋体;"" />体健康的病灶牙，应予拔除。<br style=""font-family: 宋体;"" />3、近中倾斜阻生智齿，虽暂无症状，但该智齿的存在可造成第<br style=""font-family: 宋体;"" />二磨牙的远中邻面牙颈部龋洞。为了保护有重要咀嚼功能的第二磨牙，<br style=""font-family: 宋体;"" />主张早期拔除此类阻生智齿。<br style=""font-family: 宋体;"" />除此之外，对于其他牙位正常、有咀嚼功能的智齿；或虽阻生，也<br style=""font-family: 宋体;"" />没有咀嚼功能，但无不适、发炎、龋齿等并发症的智齿；或可利用它作<br style=""font-family: 宋体;"" />为义齿（假牙）修复时担当基牙的智齿，均应予以保留</p><p style=""font-family: 宋体; padding: 0px; border-width: 0px; margin: 0px; color: rgb(51, 51, 51); font-size: 12px; font-style: normal; font-variant: normal; font-weight: normal; letter-spacing: normal; line-height: 28px; orphans: auto; text-align: start; text-indent: 0px; text-transform: none; white-space: normal; widows: auto; word-spacing: 0px; -webkit-text-stroke-width: 0px; background-color: rgb(255, 255, 255);"">如果要拔掉智齿，一定要找专业牙医，否则，一旦造成下颌神经或邻牙的损伤则为时过晚了。</p>",,"智齿拔除,拔牙,",
